{
  "property_id": "_example",
  "researched_at": "2026-08-09T14:00:00Z",
  "purchase_price": {
    "value": 200000,
    "status": "VERIFIED",
    "confidence": "HIGH",
    "source": "https://example.com/listing/123",
    "evidence": "Listing asking price $200,000"
  },
  "monthly_rent": {
    "value": 2200,
    "status": "ESTIMATED",
    "confidence": "MEDIUM",
    "source": "Rent comps",
    "evidence": "Comp A: $2,100/mo similar 2BR condo. Comp B: $2,300/mo same building.",
    "range_low": 2100,
    "range_high": 2300
  },
  "hoa_monthly": {
    "value": 485,
    "status": "VERIFIED",
    "confidence": "HIGH",
    "source": "https://example.com/listing/123",
    "evidence": "Listing states HOA $485/month"
  },
  "special_assessments": {
    "value": 0,
    "status": "VERIFIED",
    "confidence": "HIGH",
    "source": "HOA disclosure document",
    "evidence": "HOA disclosure dated 2026-01 states no current or planned special assessments"
  },
  "property_taxes_annual": {
    "value": 3200,
    "status": "VERIFIED",
    "confidence": "HIGH",
    "source": "County tax records",
    "evidence": "Hillsborough County 2025 tax bill $3,200"
  },
  "insurance_annual": {
    "value": 1800,
    "status": "ESTIMATED",
    "confidence": "MEDIUM",
    "source": "Insurance quote estimate",
    "evidence": "Quote for similar condo coverage in building"
  },
  "management_annual": {
    "value": 2112,
    "status": "ESTIMATED",
    "confidence": "MEDIUM",
    "source": "Standard assumption",
    "evidence": "8% of gross rent for long-term rental management"
  },
  "utilities_annual": {
    "value": 0,
    "status": "VERIFIED",
    "confidence": "HIGH",
    "source": "Listing",
    "evidence": "Tenant pays all utilities per listing"
  },
  "other_expenses_annual": {
    "value": 0,
    "status": "VERIFIED",
    "confidence": "HIGH",
    "source": "HOA disclosure",
    "evidence": "No resort fees, club fees, or rental program fees"
  },
  "rental_restrictions": {
    "value": null,
    "status": "VERIFIED",
    "confidence": "HIGH",
    "source": "HOA docs",
    "evidence": "No minimum lease term; rentals permitted"
  },
  "str_restrictions": {
    "value": null,
    "status": "VERIFIED",
    "confidence": "HIGH",
    "source": "HOA docs",
    "evidence": "STR prohibited; long-term rental only"
  }
}
