{
  "property_id": "cuenca-banos-ultramodern-mansion-ec",
  "researched_at": "2026-08-10T07:00:00Z",
  "purchase_price": {
    "value": 550000,
    "status": "VERIFIED",
    "confidence": "HIGH",
    "source": "https://yapatree.com/buy-properties-cuenca/luxury-ultra-modern-mansion-in-a-gated-community/",
    "evidence": "Listing asking price $550,000."
  },
  "monthly_rent": {
    "value": 1800,
    "status": "ESTIMATED",
    "confidence": "MEDIUM",
    "source": "Local rent comps (YapaTree/FazWaz/GringoPost/MLS)",
    "evidence": "See research notes. Range $1400-$2500.",
    "range_low": 1400,
    "range_high": 2500
  },
  "hoa_monthly": {
    "value": null,
    "status": "UNKNOWN",
    "confidence": "LOW",
    "source": "https://yapatree.com/buy-properties-cuenca/luxury-ultra-modern-mansion-in-a-gated-community/",
    "evidence": "No published alicuota; prior tracker value of $0 cleared as unverified. Confirm with seller/admin."
  },
  "special_assessments": {
    "value": null,
    "status": "UNKNOWN",
    "confidence": "LOW",
    "source": "No source",
    "evidence": "No special assessment disclosure found."
  },
  "property_taxes_annual": {
    "value": 50,
    "status": "ESTIMATED",
    "confidence": "LOW",
    "source": "Listing mirrors / Ecuador impuesto predial norms",
    "evidence": "Ecuador predial typically low vs market value; estimate pending municipal bill."
  },
  "insurance_annual": {
    "value": 400,
    "status": "ESTIMATED",
    "confidence": "MEDIUM",
    "source": "Ecuador homeowners insurance norms",
    "evidence": "Owner policy estimate for highland SFH."
  },
  "management_annual": {
    "value": 2160,
    "status": "ESTIMATED",
    "confidence": "MEDIUM",
    "source": "Ecuador LTR management 8-15%",
    "evidence": "10% of $1800/mo rent."
  },
  "utilities_annual": {
    "value": 0,
    "status": "ESTIMATED",
    "confidence": "MEDIUM",
    "source": "Lease convention",
    "evidence": "Tenant-paid utilities assumed for LTR."
  },
  "other_expenses_annual": {
    "value": 1200,
    "status": "ESTIMATED",
    "confidence": "LOW",
    "source": "Maintenance reserves",
    "evidence": "Gardening/maintenance reserve for SFH."
  },
  "rental_restrictions": {
    "value": null,
    "status": "UNKNOWN",
    "confidence": "LOW",
    "source": "No bylaws",
    "evidence": "No rental restriction docs obtained."
  },
  "str_restrictions": {
    "value": null,
    "status": "UNKNOWN",
    "confidence": "LOW",
    "source": "No bylaws",
    "evidence": "STR not evidenced; treat as LTR-only until verified."
  },
  "notes": "Synced from Supabase tracker research 2026-08-10. Gross ~3.9% at $1,800 rent. Supabase unit_id=9ddf8229-6a70-4a2c-9433-8e0850909a2e."
}
