{
  "property_id": "poseidon-unit-12f-barbasquillo-manta-ec",
  "researched_at": "2026-08-10T06:45:00Z",
  "purchase_price": {
    "value": 139000,
    "status": "VERIFIED",
    "confidence": "HIGH",
    "source": "https://ecuador.propertyshelf.com/en/front-page/rs1800320, https://mls.mls-ecuador.com/agencies/puertocayo/listings/rs1800320/",
    "evidence": "Active MLS RS1800320: Poseidon 12th-floor corner 1BR/1BA, 69m², fully furnished, oceanfront Barbasquillo. List price $139,000. Year built 2015, remodelled 2017. 1 garage parking."
  },
  "monthly_rent": {
    "value": 900,
    "status": "ESTIMATED",
    "confidence": "MEDIUM",
    "source": "Poseidon building rent comps; AirROI Manta STR 2026",
    "evidence": "Building comps: Poseidon 2BR units advertised rented at $1,300/mo (incl. alicuota/internet/water on some ads); larger 2BR+office listed rented $1,300. Subject is 1BR 69m² — smaller. Scout $1,200 STR appears optimistic vs AirROI Manta avg $4,104/yr ($342/mo) and 21.7% occupancy. Listing claims popular rental unit. Blended estimate: LTR $750-950 or strong STR $800-1,100. Used $900 mid. Gross at $900 is 7.8% before HOA — underwriter should stress-test.",
    "range_low": 750,
    "range_high": 1100
  },
  "hoa_monthly": {
    "value": 185,
    "status": "VERIFIED",
    "confidence": "HIGH",
    "source": "https://ecuador.propertyshelf.com/en/front-page/rs1800320, https://mls.mls-ecuador.com/agencies/puertocayo/listings/rs1800320/",
    "evidence": "MLS Association Fee Amount (Monthly) / Valor de Alicuotas = $185 for this unit. Sibling Poseidon units show higher alicuotas ($328-$400) for larger floorplans — $185 is consistent for 1BR. HOA often includes insurance/security/pool; confirm inclusions via estoppel."
  },
  "special_assessments": {
    "value": null,
    "status": "UNKNOWN",
    "confidence": "LOW",
    "source": "No source available",
    "evidence": "No special assessment disclosed on MLS listing. Poseidon is ~2015 hotel-condo; capital projects possible but no current assessment documented. Treat as UNKNOWN (not verified zero)."
  },
  "property_taxes_annual": {
    "value": 175,
    "status": "ESTIMATED",
    "confidence": "MEDIUM",
    "source": "https://taxsummaries.pwc.com/ecuador/individual/other-taxes, https://www.expatfocus.com/ecuador/guide/ecuador-property-taxes",
    "evidence": "Ecuador impuesto predial is 0.025%-0.5% of cadastral value (typically well below market). Comparable Manta condos often pay $100-400/yr. For ~$139,000 market price, estimated $111-417/yr; used $175. Exact bill depends on Manta municipal rate and cadastral assessment.",
    "range_low": 111,
    "range_high": 417
  },
  "insurance_annual": {
    "value": 325,
    "status": "ESTIMATED",
    "confidence": "MEDIUM",
    "source": "https://expatsecuador.com/living/homeowners-renters-insurance-ecuador/, https://ameliaandjp.com/insurances-in-ecuador/",
    "evidence": "Building structure insurance is typically included in Ecuador alicuota. Owner contents/liability: ~$140-210/yr base; Manta coastal earthquake risk adds 15-20%. For ~$139,000 condo, estimated $200-400/yr supplemental owner policy; used $325.",
    "range_low": 200,
    "range_high": 400
  },
  "management_annual": {
    "value": 2160,
    "status": "ESTIMATED",
    "confidence": "MEDIUM",
    "source": "https://www.airdna.co/blog/how-much-do-property-managers-charge, https://www.guestable.com/blog/airbnb-management-fees/",
    "evidence": "STR full-service management in LatAm commonly 15-30% of gross. At estimated $900/mo ($10800/yr), 20% = $2160/yr. Co-hosting or self-management would reduce this.",
    "range_low": 0,
    "range_high": 3240
  },
  "utilities_annual": {
    "value": 0,
    "status": "ESTIMATED",
    "confidence": "LOW",
    "source": "Poseidon rental listings; market convention",
    "evidence": "Some Poseidon rentals include water/internet in rent+alicuota package (owner absorbs via HOA/rent). Central AC maintenance sometimes in HOA per MLS comments on sibling units. Owner incremental utilities assumed $0 if LTR tenant-paid or STR recovered in ADR; if owner pays AC common charges beyond HOA, unknown.",
    "range_low": 0,
    "range_high": 1200
  },
  "other_expenses_annual": {
    "value": 400,
    "status": "ESTIMATED",
    "confidence": "LOW",
    "source": "Hotel-condo ownership research",
    "evidence": "Furnished oceanfront unit: FF&E replacement reserve, possible rental program fees if using on-site hotel ops. Estimated $400/yr misc; confirm any mandatory rental program.",
    "range_low": 0,
    "range_high": 1000
  },
  "rental_restrictions": {
    "value": null,
    "status": "ESTIMATED",
    "confidence": "MEDIUM",
    "source": "https://ecuador.propertyshelf.com/en/front-page/rs1800320, Poseidon rental listings",
    "evidence": "Poseidon operates as hotel-condo with active long-term and vacation rentals advertised building-wide. No rental ban on this listing. Confirm reglamento and any rental-program requirements."
  },
  "str_restrictions": {
    "value": null,
    "status": "ESTIMATED",
    "confidence": "MEDIUM",
    "source": "Poseidon building STR listings; AirROI Manta Low regulation",
    "evidence": "Building commonly marketed for Airbnb/STR. City regulation Low. Hotel-condo rules may require using building management or meeting minimum standards — not verified for this unit. Confirm before underwriting STR case."
  },
  "notes": "Best-documented HOA in Ecuador SCREENED batch ($185 verified). After HOA, scout already flagged adjusted yield ~8.8% even at $1,200 rent; researched rent $900 is more conservative vs AirROI. Likely underwriting REJECTED/WATCHLIST unless rent proves higher. Special assessments still UNKNOWN."
}
